จ31202,ภาษาจีน 2,3,6,พัฒนาทักษะภาษาจีนเบื้องต้น การออกเสียงพยัญชนะ สระ และวรรณยุกต์ในระบบ Hanyu Pinyin รวมถึงการฟัง พูด อ่าน เขียนตัวอักษรจีน การใช้ภาษาจีนในสถานการณ์ต่าง ๆ เช่น การแนะนำตนเองและการตั้งคำถาม เพื่อส่งเสริมให้ผู้เรียนใช้ภาษาได้อย่างสร้างสรรค์และเข้าใจความเหมือน-ต่างระหว่างวัฒนธรรมไทย-จีน,อ.ชัญญภัค,1,ศิลป์,6,เฉพาะนักเรียน ศิลป์-ภาษา,✔,✔,,,,,✔,✔,,,✔,✔,,,,,,,
ญ31202,ภาษาญี่ปุ่น 2,3,6,"เรียนรู้ภาษาญี่ปุ่นระดับ A1 ในหัวข้อพื้นฐาน เช่น การผันคำกริยา, การนับเลข, ครอบครัว และวันเดือนปี นอกจากนี้ยังได้เรียนรู้วัฒนธรรมญี่ปุ่นผ่านกิจกรรมที่ทำจริงและค้นคว้าด้วยตนเอง เพื่อให้สามารถสื่อสารภาษาญี่ปุ่นเบื้องต้นได้อย่างเข้าใจและมีทัศนคติที่ดี","อ.ทาเคชิ / 
อ.ดร.กวิตา",1,ศิลป์,4,เฉพาะนักเรียน ศิลป์-ภาษา,✔,✔,,,,,✔,✔,,,✔,✔,,,,,,,
กลุ่มกิจกรรมพัฒนาผู้เรียน,,,,,,,,,,,,,,,,,,,,,,,,,,,,
พ31211,ผู้นำค่ายพักแรม,1,2,เพื่อพัฒนาการเป็นผู้นำ และผู้ให้ความรู้ ความเข้าใจในเรื่องของค่ายพักแรม และกิจกรรมกลางแจ้ง กิจกรรมการท่องเที่ยวทัศนศึกษา สร้างเสริมประสบการณ์ชีวิต สร้างความประทับใจ ความซาบซึ้งในธรรมชาติ ศิลปวัฒนธรรม ประเพณี วิถีชีวิตของชุมชนและสังคมในลักษณะต่าง ๆ,อ.ชวลิต,1,ทุกกลุ่ม,25,,,,,,,,,,,,,,,✔,✔,,,,
พ31205,"แคมป์ปิ้งและกิจกรรม
กลางแจ้ง",1,2,"เพื่อให้นักเรียนได้ทราบและมีความเข้าใจ ในขบวนการจัดค่ายพักแรมประเภทต่าง ๆ การบริหารและจัดการค่ายประเภทต่างๆ และการจัดกิจกรรมกลางแจ้ง กิจกรรมการท่องเที่ยวทัศนศึกษา สร้างเสริมประสบการณ์ชีวิต สร้างความประทับใจ 
ความซาบซึ้งในธรรมชาติ ศิลปะวัฒนะธรรม ประเพณี วิถีชีวิตของชุมชนและสังคมในลักษณะต่าง ๆ ของประเทศไทย",อ.ชวลิต,1,ทุกกลุ่ม,25,,,,,,,,,,✔,✔,,,,,,,,,